{
  "$schema": "./catalog.schema.json",
  "kind": "PlanTemplate",
  "catalog_version": "1.0.0",
  "envelope_defaults": {
    "object_type": "PlanTemplate",
    "human_readable_summary": "Plan templates describe what an organization has purchased — entitlement only, not authority. Every plan includes DMW baseline + safety baseline + audit baseline. Customers should not pay extra just to have memory be safe.",
    "model_usage_notes": "Plans entitle availability; Foundation governance authorizes activation. Plans are STATIC catalog templates — never runtime billing state. Never quote pricing as final or contractual. Never gate Foundation safety/audit/DMW baseline behind a plan.",
    "scope_defaults": ["TENANT_SCOPED", "PLAN_SCOPED"],
    "permission_defaults": ["READ_FIRST", "BILLING_ADMIN_REQUIRED_FOR_PLAN_CHANGE", "GOVERNANCE_APPROVAL_FOR_ACTIVATION"],
    "provenance": {
      "authored_by": "NIOV Labs / niov-foundation",
      "source": "docs/entitlement-catalog/plans.json",
      "version_tag": "section-8-b2-v1.0.0",
      "captured_at": "2026-06-01",
      "authority": "[FOUNDER-SECTION-8-B2-STATIC-ENTITLEMENT-CATALOG-AUTH]"
    },
    "audit_expectations": [
      "ADMIN_ACTION:PLAN_TEMPLATE_REFERENCED when consumed",
      "ADMIN_ACTION:PLAN_CHANGE_REQUESTED at future B3+ runtime",
      "ADMIN_ACTION:PLAN_CHANGE_APPROVED at future B4+ runtime"
    ],
    "policy_purpose": "CATALOG_REFERENCE_ONLY",
    "allowed_consumers": ["BILLING_ADMIN_REVIEW", "CONTROL_TOWER_BILLING_PREVIEW", "FOUNDATION_GOVERNANCE_TIER"],
    "forbidden_consumers": ["AGENT_TWIN_UNAPPROVED_BILLING_CHANGE", "AGENT_TWIN_CROSS_TENANT", "EXTERNAL_THIRD_PARTY_UNAUTHORIZED"],
    "sensitivity_level": "HIGH"
  },
  "items": [
    {
      "id": "plan.starter-pilot.v1",
      "version": "1",
      "status": "ACCEPTED",
      "object_type": "PlanTemplate",
      "name": "Starter / Pilot",
      "description": "Entry plan for evaluation, small teams, and pilot deployments. Includes the canonical $250/month base + Dandelion Preview + baseline Admin Twin guidance + baseline audit + baseline DMW + limited workflow recommendations. No advanced connector writes. No payment provider runtime yet.",
      "human_readable_summary": "Starter / Pilot. $250/month base. Baseline DMW included. Dandelion Preview. Limited seats. Foundation safety + audit baseline never paywalled.",
      "model_usage_notes": "Treat Starter / Pilot as evaluation entitlement. Do not assume the customer has any advanced capability pack, any premium DMW governance, any active connector pack, or any executed workflow runtime.",
      "source_adr_refs": ["ADR-0083", "ADR-0080", "ADR-0082", "ADR-0084", "ADR-0070"],
      "governance_notes": "Even at Starter / Pilot, Foundation governance, audit chain integrity, DMW baseline safety, and same-org boundary remain absolute. Billing does not weaken governance.",
      "billing_notes": "Plan_id: starter-pilot. Base: $250/month suggested internal anchor. Future B3 may add usage caps. Final public pricing is product-team-decided; never claim contractual pricing here.",
      "safe_defaults": [
        "DMW_baseline_included",
        "safety_baseline_included",
        "audit_baseline_included",
        "Dandelion_Preview_included",
        "Admin_Twin_baseline_guidance_when_built",
        "limited_workflow_recommendations"
      ],
      "forbidden_defaults": [
        "no_advanced_connector_writes",
        "no_executed_workflow_runtime_in_B2",
        "no_payment_provider_runtime_in_B2",
        "no_premium_DMW_governance",
        "no_enterprise_evidence_pack",
        "no_SSO_SAML_SCIM"
      ],
      "allowed_consumers": ["BILLING_ADMIN_REVIEW", "CONTROL_TOWER_BILLING_PREVIEW", "FOUNDATION_GOVERNANCE_TIER"],
      "forbidden_consumers": ["AGENT_TWIN_UNAPPROVED_BILLING_CHANGE", "AGENT_TWIN_CROSS_TENANT", "EXTERNAL_THIRD_PARTY_UNAUTHORIZED"],
      "audit_expectations": ["ADMIN_ACTION:PLAN_TEMPLATE_REFERENCED at consume time", "future B3+ runtime emits PLAN_* discriminators via ADMIN_ACTION; no new audit literal in B2"],
      "plan_id": "starter-pilot",
      "target_customer": "pilot teams, evaluation deployments, small orgs",
      "included_base_features": ["DMW_baseline", "audit_baseline", "Foundation_safety_baseline", "Dandelion_Preview", "Admin_Twin_baseline_guidance_when_built"],
      "included_seat_types": ["seat.standard-twin.v1", "seat.otzar-administrator.v1"],
      "included_capability_packs": [],
      "included_usage_allowances": {"strategy": "limited_pilot_allowances; specific quotas defined at future B3+"},
      "excluded_features": ["advanced_connector_writes", "executed_workflow_runtime", "premium_DMW_governance", "enterprise_evidence_pack", "SSO_SAML_SCIM"],
      "upgrade_path": "starter-pilot -> team -> business -> enterprise",
      "downgrade_behavior": "Per docs/entitlement-catalog/downgrade-policies.json — never deletes audit history, never violates retention, never breaks evidence integrity.",
      "DMW_baseline_included": true,
      "safety_baseline_included": true,
      "audit_baseline_included": true
    },
    {
      "id": "plan.team.v1",
      "version": "1",
      "status": "ACCEPTED",
      "object_type": "PlanTemplate",
      "name": "Team",
      "description": "Standard team plan. $250 base + per-seat. Standard / Professional Twin seats. Collaboration Pack candidate. Basic workflow recommendations. Baseline DMW. Basic audit.",
      "human_readable_summary": "Team. $250 base + seats. Standard / Professional Twin seats. Collaboration Pack candidate. Baseline DMW + audit.",
      "model_usage_notes": "Team entitles Collaboration Pack candidacy + basic workflow recommendations. Connector activation still requires Foundation governance approval and map-region approval per ADR-0082 + ADR-0084.",
      "source_adr_refs": ["ADR-0083", "ADR-0084", "ADR-0082", "ADR-0080"],
      "governance_notes": "Connector pack entitlement makes a connector available; it does not authorize activation. Map-region approval + admin policy approval still required.",
      "billing_notes": "Plan_id: team. Base: $250/month + per-seat suggested internal anchors per docs/entitlement-catalog/seats.json. Final public pricing is product-team-decided.",
      "safe_defaults": ["DMW_baseline_included", "audit_baseline_included", "safety_baseline_included", "basic_workflow_recommendations"],
      "forbidden_defaults": ["no_executed_workflow_runtime_in_B2", "no_payment_provider_runtime_in_B2", "no_premium_DMW_governance", "no_SSO_SAML_SCIM"],
      "allowed_consumers": ["BILLING_ADMIN_REVIEW", "CONTROL_TOWER_BILLING_PREVIEW", "FOUNDATION_GOVERNANCE_TIER"],
      "forbidden_consumers": ["AGENT_TWIN_UNAPPROVED_BILLING_CHANGE", "AGENT_TWIN_CROSS_TENANT", "EXTERNAL_THIRD_PARTY_UNAUTHORIZED"],
      "audit_expectations": ["ADMIN_ACTION:PLAN_TEMPLATE_REFERENCED at consume time"],
      "plan_id": "team",
      "target_customer": "departments + small/mid teams",
      "included_base_features": ["DMW_baseline", "audit_baseline", "Foundation_safety_baseline", "Dandelion_Preview", "basic_workflow_recommendations"],
      "included_seat_types": ["seat.standard-twin.v1", "seat.professional-twin.v1", "seat.otzar-administrator.v1"],
      "included_capability_packs": ["pack.collaboration-pack-candidate.v1"],
      "included_usage_allowances": {"strategy": "team_tier_allowances; specific quotas defined at future B3+"},
      "excluded_features": ["executed_workflow_runtime_in_B2", "premium_DMW_governance", "enterprise_evidence_pack", "SSO_SAML_SCIM"],
      "upgrade_path": "team -> business -> enterprise",
      "downgrade_behavior": "Per docs/entitlement-catalog/downgrade-policies.json. Safety + audit + DMW baseline preserved.",
      "DMW_baseline_included": true,
      "safety_baseline_included": true,
      "audit_baseline_included": true
    },
    {
      "id": "plan.business.v1",
      "version": "1",
      "status": "ACCEPTED",
      "object_type": "PlanTemplate",
      "name": "Business",
      "description": "Business plan. More seats. Admin Twin + Dandelion Activation Pack + connector packs + Agent Playground + advanced audit + workflow recommendations / proposed actions + DMW governance baseline + selected premium controls.",
      "human_readable_summary": "Business. Admin Twin. Dandelion Activation Pack. Connector packs. Agent Playground. Advanced audit. DMW governance baseline.",
      "model_usage_notes": "Business plan entitles broader connector pack availability + Agent Playground + advanced audit. Activation still gated by Foundation governance + map-region approval per ADR-0082.",
      "source_adr_refs": ["ADR-0083", "ADR-0084", "ADR-0082", "ADR-0081", "ADR-0080"],
      "governance_notes": "Entitlement scales availability; governance still authorizes every activation. Dual-control may still apply for risky writes regardless of plan tier.",
      "billing_notes": "Plan_id: business. Annual or monthly commercial structure per future product-team decision. Final public pricing not in this catalog.",
      "safe_defaults": ["DMW_baseline_included", "audit_baseline_included", "safety_baseline_included", "Dandelion_Activation_Pack", "Admin_Twin", "Agent_Playground", "advanced_audit"],
      "forbidden_defaults": ["no_payment_provider_runtime_in_B2", "no_runtime_workflow_execution_in_B2", "no_SSO_SAML_SCIM_baseline_unless_enterprise"],
      "allowed_consumers": ["BILLING_ADMIN_REVIEW", "CONTROL_TOWER_BILLING_PREVIEW", "FOUNDATION_GOVERNANCE_TIER"],
      "forbidden_consumers": ["AGENT_TWIN_UNAPPROVED_BILLING_CHANGE", "AGENT_TWIN_CROSS_TENANT", "EXTERNAL_THIRD_PARTY_UNAUTHORIZED"],
      "audit_expectations": ["ADMIN_ACTION:PLAN_TEMPLATE_REFERENCED at consume time"],
      "plan_id": "business",
      "target_customer": "mid-market + growing enterprises",